{
  "schema_version": "0.1",
  "execution_id": "exec.example.success.001",
  "task_id": "task.example.verify-output.001",
  "plan_id": "plan.example.verify-output.001",
  "implementation_id": "impl.example.worker.1",
  "trace_events": [
    {
      "event_id": "event.example.accepted.001",
      "execution_id": "exec.example.success.001",
      "sequence": 0,
      "event_type": "execution.accepted",
      "occurred_at": "2026-10-16T12:00:00Z",
      "outcome": "accepted",
      "implementation_id": "impl.example.worker.1"
    },
    {
      "event_id": "event.example.verification.001",
      "execution_id": "exec.example.success.001",
      "sequence": 1,
      "event_type": "execution.verification",
      "occurred_at": "2026-10-16T12:00:02Z",
      "outcome": "passed",
      "artifact_refs": ["artifact.example.output.001"],
      "attributes": {
        "criterion_id": "criterion.output-present"
      }
    },
    {
      "event_id": "event.example.completed.001",
      "execution_id": "exec.example.success.001",
      "sequence": 2,
      "event_type": "execution.completed",
      "occurred_at": "2026-10-16T12:00:03Z",
      "outcome": "success"
    }
  ],
  "evidence": [
    {
      "evidence_id": "evidence.example.output.001",
      "kind": "output-artifact",
      "source": {
        "type": "worker",
        "id": "impl.example.worker.1",
        "execution_id": "exec.example.success.001",
        "event_id": "event.example.verification.001"
      },
      "created_at": "2026-10-16T12:00:02Z",
      "supports": ["criterion.output-present"],
      "artifact": {
        "uri": "urn:example:artifact:output:001",
        "media_type": "text/plain",
        "digest": {
          "algorithm": "sha-256",
          "value": "aaaaaaaaaaaaaaaaaaaaaaaaaaaaaaaaaaaaaaaaaaaaaaaaaaaaaaaaaaaaaaaa"
        },
        "integrity_status": "unverified"
      },
      "summary": "Output artifact exists and was inspected."
    }
  ],
  "evaluations": [
    {
      "evaluation_id": "evaluation.example.001",
      "execution_id": "exec.example.success.001",
      "result_id": "result.example.001",
      "criterion_set_id": "criteria.example.output-check.v1",
      "outcome": "met",
      "evaluator": {
        "type": "rule-based",
        "id": "evaluator.example.output-check",
        "version": "1"
      },
      "findings": [
        {
          "criterion_id": "criterion.output-present",
          "outcome": "met",
          "evidence_ids": ["evidence.example.output.001"],
          "summary": "The required output artifact was present."
        }
      ],
      "evaluated_at": "2026-10-16T12:00:03Z"
    }
  ]
}
